{
  "type": "action.taken",
  "timestamp": "2026-09-19T21:04:11Z",
  "sessionId": "s_8f2",
  "surface": {
    "id": "send-confirm",
    "intent": "money.send",
    "pattern": "confirm-destructive",
    "journey": "money.send",
    "specVersion": "0.1.0",
    "generator": "polyxd-3b@0.1.0",
    "direction": "calm-finance@0.1.0"
  },
  "actor": {
    "kind": "human",
    "assistiveTech": false
  },
  "component": {
    "id": "confirm",
    "type": "Confirm"
  },
  "capability": "transfer.confirm",
  "durationMs": 5400,
  "steps": 1
}
